{
  "$schema": "https://json-schema.org/draft/2020-12/schema",
  "$id": "https://schemas.sapphirus.dev/v1/model-access-compatibility.schema.json",
  "title": "sapphirus.model-access-compatibility.v1",
  "description": "The reviewed compatibility policy between version one and version two of the desktop model access request. It names the single legacy profile a version one request is adapted onto, the closed set of reasons a version one request is refused, the minimum desktop contract epoch that may still speak version one, the gate that must be satisfied before version one is removed, and the guarantee that receipts signed before version two landed stay verifiable. The adapter is one way: a version one request is lifted to version two, and a version two request is never lowered.",
  "type": "object",
  "additionalProperties": false,
  "required": [
    "schemaVersion",
    "adapterDirection",
    "currentRequestSchemaVersion",
    "acceptedRequestSchemaVersions",
    "legacyProfile",
    "rejectionReasons",
    "minimumDesktopContractEpoch",
    "historicalReceiptPolicy",
    "removalGate"
  ],
  "properties": {
    "schemaVersion": { "const": "sapphirus.model-access-compatibility.v1" },
    "adapterDirection": { "const": "v1_to_v2_only" },
    "currentRequestSchemaVersion": { "const": "desktop-model-access-request.v2" },
    "acceptedRequestSchemaVersions": {
      "description": "Request document versions the support plane still accepts, oldest first. Removing version one from this list is the observable act that closes the legacy lane.",
      "type": "array",
      "minItems": 1,
      "maxItems": 2,
      "uniqueItems": true,
      "items": { "$ref": "#/$defs/RequestSchemaVersion" }
    },
    "legacyProfile": { "$ref": "#/$defs/LegacyProfileBinding" },
    "rejectionReasons": {
      "description": "Every reason a version one request is refused rather than adapted. The list is closed and exhaustive, so a refusal always has a name the desktop can render.",
      "type": "array",
      "minItems": 1,
      "maxItems": 16,
      "uniqueItems": true,
      "items": { "$ref": "#/$defs/LegacyRejectionReason" }
    },
    "minimumDesktopContractEpoch": {
      "description": "The lowest desktop contract epoch that may still send a version one request. An installation below this epoch is refused and told to update, rather than being adapted onto the legacy profile.",
      "type": "integer",
      "minimum": 1,
      "maximum": 4096
    },
    "historicalReceiptPolicy": { "$ref": "#/$defs/HistoricalReceiptPolicy" },
    "removalGate": { "$ref": "#/$defs/LegacyRemovalGate" }
  },
  "$defs": {
    "RequestSchemaVersion": {
      "enum": [
        "desktop-model-access-request.v1",
        "desktop-model-access-request.v2"
      ]
    },
    "ReceiptSchemaVersion": {
      "enum": [
        "sapphirus.model-access-receipt.v1",
        "sapphirus.model-access-receipt.v2"
      ]
    },
    "LegacyRejectionReason": {
      "description": "Named refusals for a version one request. A version one request may keep doing exactly what its own contract already allowed and nothing more; reaching for a version two capability is refused rather than partially honoured.",
      "enum": [
        "model_selection_attempted",
        "streaming_requested",
        "variant_requested",
        "attachment_requested",
        "catalog_version_supplied",
        "tool_definition_supplied",
        "unknown_member_present",
        "contract_epoch_too_low"
      ]
    },
    "LegacyProfileBinding": {
      "description": "The single named profile every adapted version one request lands on. It exists so a legacy request still has a profile identity in the version two receipt, while its deployment stays resolved server side exactly as it was before version two. The desktop never names it, never chooses it, and cannot see the deployment behind it.",
      "type": "object",
      "additionalProperties": false,
      "required": [
        "profileId",
        "displayName",
        "deploymentResolution",
        "clientSelectable",
        "requiresCatalogVersion",
        "requestMode",
        "variantPolicy"
      ],
      "properties": {
        "profileId": { "$ref": "./model-profile.schema.json#/$defs/ModelProfileId" },
        "displayName": { "type": "string", "minLength": 1, "maxLength": 64 },
        "deploymentResolution": { "const": "server_side_only" },
        "clientSelectable": { "const": false },
        "requiresCatalogVersion": { "const": false },
        "requestMode": { "const": "structured_response" },
        "variantPolicy": { "const": "profile_default_only" }
      }
    },
    "HistoricalReceiptPolicy": {
      "description": "Receipts signed before version two landed must keep verifying with no change to how their digest is computed. Version two adds a second receipt family; it does not restate or re-sign the first.",
      "type": "object",
      "additionalProperties": false,
      "required": [
        "verifiableReceiptSchemaVersions",
        "digestPurpose",
        "version1DigestUnchanged",
        "reverificationRequired"
      ],
      "properties": {
        "verifiableReceiptSchemaVersions": {
          "type": "array",
          "minItems": 1,
          "maxItems": 2,
          "uniqueItems": true,
          "items": { "$ref": "#/$defs/ReceiptSchemaVersion" }
        },
        "digestPurpose": { "const": "model-access-receipt" },
        "version1DigestUnchanged": { "const": true },
        "reverificationRequired": { "const": false }
      }
    },
    "LegacyRemovalGate": {
      "description": "What must be true before version one stops being accepted. Every condition is observable from evidence the support plane already produces, so the removal decision is not a judgement call.",
      "type": "object",
      "additionalProperties": false,
      "required": [
        "removalContractEpoch",
        "minimumDesktopVersion",
        "conditions"
      ],
      "properties": {
        "removalContractEpoch": {
          "type": "integer",
          "minimum": 2,
          "maximum": 4096
        },
        "minimumDesktopVersion": {
          "type": "string",
          "minLength": 5,
          "maxLength": 64,
          "pattern": "^[0-9]+\\.[0-9]+\\.[0-9]+(-[0-9A-Za-z.-]+)?$"
        },
        "conditions": {
          "type": "array",
          "minItems": 1,
          "maxItems": 8,
          "uniqueItems": true,
          "items": { "$ref": "#/$defs/LegacyRemovalCondition" }
        }
      }
    },
    "LegacyRemovalCondition": {
      "enum": [
        "catalog_published_for_every_tenant",
        "every_installation_at_removal_epoch",
        "legacy_profile_retired_from_catalog",
        "historical_receipt_replay_verified"
      ]
    }
  }
}
